{
  "schemaVersion": "1.0",
  "id": "enem-2024-d2-c07-azul-q102",
  "area": "ciencias-da-natureza",
  "statement": "Utilizando esse procedimento, o sabor foi conservado porque houve",
  "supportText": "Uma agricultora, com a intenção de comercializar o milho recém-colhido, testou uma forma de preservar o sabor adocicado do seu produto. O melhor resultado foi obtido quando ela imergiu as espigas em água fervente durante alguns minutos e, em seguida, em água gelada. Com esse procedimento, parte da glicose do milho não foi transformada em amido, mantendo o seu sabor adocicado.",
  "alternatives": [
    {
      "id": "A",
      "text": "desnaturação enzimática pela alta temperatura."
    },
    {
      "id": "B",
      "text": "conversão de nutrientes pela redução de temperatura."
    },
    {
      "id": "C",
      "text": "degradação das reservas nutritivas pelo choque térmico."
    },
    {
      "id": "D",
      "text": "impedimento da entrada de oxigênio pela fervura da água."
    },
    {
      "id": "E",
      "text": "desidratação dos grãos por causa da alteração da temperatura."
    }
  ],
  "correctAlternative": "A",
  "references": [],
  "media": [],
  "sharedStimulusIds": [],
  "source": {
    "exam": "ENEM",
    "examId": "enem-2024-d2-c07-azul",
    "year": 2024,
    "day": 2,
    "booklet": 7,
    "color": "azul",
    "number": 102,
    "language": null,
    "filename": "2024_PV_impresso_D2_CD7.pdf",
    "sha256": "0993ae687a93dfbcda8e95ce8708883be9d5a55cabbe1f1a06b81a50c18c6cdc"
  },
  "provenance": {
    "extractor": "enem-extractor",
    "extractorVersion": "0.1.0",
    "confidence": 1,
    "warnings": []
  }
}
