{
  "schemaVersion": "1.0",
  "id": "enem-2024-d2-c07-azul-q156",
  "area": "matematica",
  "statement": "Nessas condições, a expressão que fornece o valor V a ser pago por uma viagem desse aplicativo é",
  "supportText": "O uso de aplicativos de transporte tem sido uma alternativa à população que busca preços mais competitivos para se locomover, principalmente nas grandes cidades. As formas usadas para determinar o valor cobrado por cada viagem variam de um aplicativo para outro, mas, em geral, o valor V a ser pago, em real, varia em função de: • tarifa base F: valor fixo, em real, cobrado no início da viagem; • tempo T: tempo, em minuto, de duração da viagem; • distância D: distância percorrida, em quilômetro. Um desses aplicativos cobra R$ 2,00 de valor fixo, acrescido de R$ 0,26 por minuto de viagem e de R$ 1,40 por quilômetro rodado.",
  "alternatives": [
    {
      "id": "A",
      "text": "2,00F + 0,26T + 1,40D"
    },
    {
      "id": "B",
      "text": "2,00 + 0,26T + 1,40D"
    },
    {
      "id": "C",
      "text": "2,00 + 0,26T + D"
    },
    {
      "id": "D",
      "text": "0,26T + 1,40D"
    },
    {
      "id": "E",
      "text": "F + T + D"
    }
  ],
  "correctAlternative": "B",
  "references": [],
  "media": [],
  "sharedStimulusIds": [],
  "source": {
    "exam": "ENEM",
    "examId": "enem-2024-d2-c07-azul",
    "year": 2024,
    "day": 2,
    "booklet": 7,
    "color": "azul",
    "number": 156,
    "language": null,
    "filename": "2024_PV_impresso_D2_CD7.pdf",
    "sha256": "0993ae687a93dfbcda8e95ce8708883be9d5a55cabbe1f1a06b81a50c18c6cdc"
  },
  "provenance": {
    "extractor": "enem-extractor",
    "extractorVersion": "0.1.0",
    "confidence": 1,
    "warnings": []
  }
}
