{
  "schemaVersion": "1.0",
  "id": "enem-2024-d1-c01-azul-q001-en",
  "area": "linguagens",
  "statement": "A relação entre as citações atribuídas ao físico Albert Einstein e ao cantor e compositor Bob Marley reside na crença de que é necessário",
  "supportText": "",
  "alternatives": [
    {
      "id": "A",
      "text": "dar oportunidade a pessoas que parecem necessitadas."
    },
    {
      "id": "B",
      "text": "identificar contextos que podem representar perigo."
    },
    {
      "id": "C",
      "text": "tirar proveito de situações que podem ser adversas."
    },
    {
      "id": "D",
      "text": "evitar dificuldades que parecem ser intransponíveis."
    },
    {
      "id": "E",
      "text": "contestar circunstâncias que parecem ser harmônicas."
    }
  ],
  "correctAlternative": "C",
  "references": [
    "Disponível em: http://thumbpress.com. Acesso em: 28 out. 2013."
  ],
  "media": [
    {
      "id": "enem-2024-d1-c01-azul-q001-en-m01",
      "kind": "image",
      "path": "/content/enem-2024-d1-c01-azul/questions/enem-2024-d1-c01-azul-q001-en/media-01.png",
      "alt": "Conteúdo visual da questão 1 do ENEM 2024"
    }
  ],
  "sharedStimulusIds": [],
  "source": {
    "exam": "ENEM",
    "examId": "enem-2024-d1-c01-azul",
    "year": 2024,
    "day": 1,
    "booklet": 1,
    "color": "azul",
    "number": 1,
    "language": "en",
    "filename": "2024_PV_impresso_D1_CD1.pdf",
    "sha256": "b0adc1dc79a002aba36f725f1ef792cf53e47ff75ee012638ef34a4e6fbb18f5"
  },
  "provenance": {
    "extractor": "enem-extractor",
    "extractorVersion": "0.1.0",
    "confidence": 1,
    "warnings": []
  }
}
