{
  "schemaVersion": "1.0",
  "id": "enem-2024-d2-c07-azul-q138",
  "area": "matematica",
  "statement": "O número de possibilidades diferentes que esse funcionário tem para cadastrar sua senha é",
  "supportText": "Para abrir a porta de uma empresa, cada funcionário deve cadastrar uma senha utilizando um teclado alfanumérico como o representado na figura. Por exemplo: a tecla que contém o número 2 traz as letras correlacionadas A, B e C. Cada toque nessa tecla mostra, sequencialmente, os seguintes caracteres: 2, A, B e C. Para os próximos toques, essa sequência se repete. As demais teclas funcionam da mesma maneira. As senhas a serem cadastradas pelos funcionários devem conter 5 caracteres, sendo 2 algarismos distintos seguidos de 3 letras diferentes, nessa ordem. Um funcionário irá cadastrar a sua primeira senha, podendo escolher entre as teclas que apresentam os números 1, 2, 5, 7 e 0 e as respectivas letras correlacionadas, quando houver.",
  "alternatives": [
    {
      "id": "A",
      "text": "11 520."
    },
    {
      "id": "B",
      "text": "14 400."
    },
    {
      "id": "C",
      "text": "18 000."
    },
    {
      "id": "D",
      "text": "312 000."
    },
    {
      "id": "E",
      "text": "390 000."
    }
  ],
  "correctAlternative": "B",
  "references": [],
  "media": [
    {
      "id": "enem-2024-d2-c07-azul-q138-m01",
      "kind": "image",
      "path": "/content/enem-2024-d2-c07-azul/questions/enem-2024-d2-c07-azul-q138/media-01.png",
      "alt": "Conteúdo visual da questão 138 do ENEM 2024"
    }
  ],
  "sharedStimulusIds": [],
  "source": {
    "exam": "ENEM",
    "examId": "enem-2024-d2-c07-azul",
    "year": 2024,
    "day": 2,
    "booklet": 7,
    "color": "azul",
    "number": 138,
    "language": null,
    "filename": "2024_PV_impresso_D2_CD7.pdf",
    "sha256": "0993ae687a93dfbcda8e95ce8708883be9d5a55cabbe1f1a06b81a50c18c6cdc"
  },
  "provenance": {
    "extractor": "enem-extractor",
    "extractorVersion": "0.1.0",
    "confidence": 1,
    "warnings": []
  }
}
