{
  "schemaVersion": "1.0",
  "id": "enem-2025-d2-c07-azul-q097",
  "area": "ciencias-da-natureza",
  "statement": "O antígeno utilizado na vacina causa um efeito protetor contra o vírus porque",
  "supportText": "A produção de vacinas exige uma sequência de procedimentos, além do cumprimento estrito de verificações de segurança. No esquema, estão demonstradas as etapas básicas realizadas para a fabricação de uma vacina utilizando a tecnologia tradicional e o efeito dela no organismo.",
  "alternatives": [
    {
      "id": "A",
      "text": "mata o vírus pela ligação."
    },
    {
      "id": "B",
      "text": "aglutina o vírus por associação."
    },
    {
      "id": "C",
      "text": "contém imunoglobulinas de defesa."
    },
    {
      "id": "D",
      "text": "induz a produção de proteínas neutralizadoras."
    },
    {
      "id": "E",
      "text": "mantém a quantidade de anticorpos preexistentes."
    }
  ],
  "correctAlternative": "D",
  "references": [],
  "media": [
    {
      "id": "enem-2025-d2-c07-azul-q097-m01",
      "kind": "image",
      "path": "/content/enem-2025-d2-c07-azul/questions/enem-2025-d2-c07-azul-q097/media-01.png",
      "alt": "Conteúdo visual da questão 97 do ENEM 2025"
    }
  ],
  "sharedStimulusIds": [],
  "source": {
    "exam": "ENEM",
    "examId": "enem-2025-d2-c07-azul",
    "year": 2025,
    "day": 2,
    "booklet": 7,
    "color": "azul",
    "number": 97,
    "language": null,
    "filename": "2025_PV_impresso_D2_CD7.pdf",
    "sha256": "39af0f0eaf3e30a3cd211bc19db9029204703965a2c76ff232fb3109181fa7c8"
  },
  "provenance": {
    "extractor": "enem-extractor",
    "extractorVersion": "0.1.0",
    "confidence": 1,
    "warnings": []
  }
}
