{
  "schemaVersion": "1.0",
  "id": "enem-2025-d1-c01-azul-q026",
  "area": "linguagens",
  "statement": "Esse texto, que apresenta um prato da culinária brasileira, evidencia",
  "supportText": "",
  "alternatives": [
    {
      "id": "A",
      "text": "valor afetivo nas nomenclaturas."
    },
    {
      "id": "B",
      "text": "variedade linguística entre regiões."
    },
    {
      "id": "C",
      "text": "disputa regional pelo melhor prato."
    },
    {
      "id": "D",
      "text": "modos de preparo de um mesmo alimento."
    },
    {
      "id": "E",
      "text": "paladares diversificados entre diferentes estados."
    }
  ],
  "correctAlternative": "B",
  "references": [
    "Revista Língua Portuguesa, n. 31, maio 2008 (adaptado)."
  ],
  "media": [
    {
      "id": "enem-2025-d1-c01-azul-q026-m01",
      "kind": "image",
      "path": "/content/enem-2025-d1-c01-azul/questions/enem-2025-d1-c01-azul-q026/media-01.png",
      "alt": "Conteúdo visual da questão 26 do ENEM 2025"
    }
  ],
  "sharedStimulusIds": [],
  "source": {
    "exam": "ENEM",
    "examId": "enem-2025-d1-c01-azul",
    "year": 2025,
    "day": 1,
    "booklet": 1,
    "color": "azul",
    "number": 26,
    "language": null,
    "filename": "2025_PV_impresso_D1_CD1.pdf",
    "sha256": "a0f19f878d4ef3ba94c3e0f5ef9e57c13fb046d4bb362f72651898b473ddb7c8"
  },
  "provenance": {
    "extractor": "enem-extractor",
    "extractorVersion": "0.1.0",
    "confidence": 1,
    "warnings": []
  }
}
