{
  "schemaVersion": "1.0",
  "id": "enem-2024-d1-c01-azul-q004-es",
  "area": "linguagens",
  "statement": "Nesse texto, ao utilizar a expressão “morir muy vivos”, a escritora Rosa Montero evidencia a importância de se",
  "supportText": "Morir muy vivos No todo es perder, es cierto. Si te esfuerzas mucho y bien, porque no viene de fábrica, ganas conocimiento del mundo y de ti mismo, empatía, sosiego y, en suma, algo que podríamos denominar sabiduría. Pero creo que para ello hay que mantenerse alerta y no darse nunca por vencido. Pero también es un tiempo para saldar cuentas. No creo que haya que dejarse llevar por el peso de los días como un leño podrido al que las olas arrojan finalmente a la playa. Uno siempre puede intentar sacarse alguna de las piedras que lleva a la espalda, decir las cosas que nunca se atrevió a decir, cumplir en la medida de lo posible los deseos arrumbados, rescatar algún sueño que quedó en la cuneta. No rendirse, esa es la clave. Y sobre todo decirse: ¿y por qué no? Porque la vejez no está reñida con la audacia. Debemos aspirar a morir muy vivos.",
  "alternatives": [
    {
      "id": "A",
      "text": "acumular sabedoria com o passar do tempo."
    },
    {
      "id": "B",
      "text": "observar o impacto dos anos sobre o corpo."
    },
    {
      "id": "C",
      "text": "rever os erros e os acertos de sua trajetória."
    },
    {
      "id": "D",
      "text": "desfrutar de todas as fases da vida."
    },
    {
      "id": "E",
      "text": "libertar das amarras sociais."
    }
  ],
  "correctAlternative": "D",
  "references": [
    "MONTERO, R. Disponível em: https://elpais.com.",
    "Acesso em: 4 dez. 2017."
  ],
  "media": [],
  "sharedStimulusIds": [],
  "source": {
    "exam": "ENEM",
    "examId": "enem-2024-d1-c01-azul",
    "year": 2024,
    "day": 1,
    "booklet": 1,
    "color": "azul",
    "number": 4,
    "language": "es",
    "filename": "2024_PV_impresso_D1_CD1.pdf",
    "sha256": "b0adc1dc79a002aba36f725f1ef792cf53e47ff75ee012638ef34a4e6fbb18f5"
  },
  "provenance": {
    "extractor": "enem-extractor",
    "extractorVersion": "0.1.0",
    "confidence": 1,
    "warnings": []
  }
}
